{
  "$schema": "./05_SEED_SCHEMA.json",
  "metadata": {
    "bundleId": "JOSYS-OPS-NAV-SEED-001",
    "version": "1.0.0",
    "asOf": "2026-07-17",
    "locale": "ja-JP",
    "timezone": "Asia/Tokyo",
    "syntheticOnly": true,
    "demoOnly": true,
    "productionSeedAllowed": false,
    "fixedNow": "2026-07-17T07:00:00Z"
  },
  "flows": [
    {"id": "F01", "name": "人・所属・アカウント", "expectedOperationCount": 3, "factStatus": "CONFIRMED"},
    {"id": "F02", "name": "端末・資産", "expectedOperationCount": 6, "factStatus": "CONFIRMED"},
    {"id": "F03", "name": "ネットワーク・インフラ", "expectedOperationCount": 2, "factStatus": "CONFIRMED"},
    {"id": "F04", "name": "SaaS・業務システム", "expectedOperationCount": 3, "factStatus": "CONFIRMED"},
    {"id": "F05", "name": "Drive・データ共有・復元", "expectedOperationCount": 3, "factStatus": "CONFIRMED"},
    {"id": "F06", "name": "セキュリティ・事故", "expectedOperationCount": 4, "factStatus": "CONFIRMED"},
    {"id": "F07", "name": "サポート・ナレッジ", "expectedOperationCount": 6, "factStatus": "CONFIRMED"},
    {"id": "F08", "name": "契約・ライセンス・予算", "expectedOperationCount": 5, "factStatus": "CONFIRMED"},
    {"id": "F09", "name": "ログ・バックアップ・証跡", "expectedOperationCount": 3, "factStatus": "CONFIRMED"},
    {"id": "F10", "name": "IT統制・経営・Pマーク", "expectedOperationCount": 7, "factStatus": "CONFIRMED"},
    {"id": "F11", "name": "自動化資産・ジョブ", "expectedOperationCount": 1, "factStatus": "CONFIRMED"}
  ],
  "operations": [
    {"id": "1-1", "name": "Wi-Fi障害の一次対応", "flowId": "F03", "operationalPriority": null, "priorityFactStatus": "NEEDS_CONFIRMATION", "factStatus": "CONFIRMED"},
    {"id": "1-2", "name": "機器構成の把握・業者連携", "flowId": "F03", "operationalPriority": null, "priorityFactStatus": "NEEDS_CONFIRMATION", "factStatus": "CONFIRMED"},
    {"id": "1-3", "name": "共有ドライブの権限付与・削除", "flowId": "F05", "operationalPriority": null, "priorityFactStatus": "NEEDS_CONFIRMATION", "factStatus": "CONFIRMED"},
    {"id": "1-4", "name": "外部共有の設定・トラブル対応", "flowId": "F05", "operationalPriority": null, "priorityFactStatus": "NEEDS_CONFIRMATION", "factStatus": "CONFIRMED"},
    {"id": "1-5", "name": "キッティング（PC/スマホ初期設定）", "flowId": "F02", "operationalPriority": null, "priorityFactStatus": "NEEDS_CONFIRMATION", "factStatus": "CONFIRMED"},
    {"id": "1-6", "name": "退職時の端末回収・初期化", "flowId": "F02", "operationalPriority": null, "priorityFactStatus": "NEEDS_CONFIRMATION", "factStatus": "CONFIRMED"},
    {"id": "1-7", "name": "管理台帳の更新・月次棚卸し", "flowId": "F02", "operationalPriority": null, "priorityFactStatus": "NEEDS_CONFIRMATION", "factStatus": "CONFIRMED"},
    {"id": "1-8", "name": "PC修理手配・代替機貸与", "flowId": "F02", "operationalPriority": null, "priorityFactStatus": "NEEDS_CONFIRMATION", "factStatus": "CONFIRMED"},
    {"id": "1-9", "name": "廃棄対象PCの処理", "flowId": "F02", "operationalPriority": null, "priorityFactStatus": "NEEDS_CONFIRMATION", "factStatus": "CONFIRMED"},
    {"id": "1-10", "name": "稼働中の自動化の維持", "flowId": "F11", "operationalPriority": null, "priorityFactStatus": "NEEDS_CONFIRMATION", "factStatus": "CONFIRMED"},
    {"id": "2-1", "name": "入社時のアカウント発行", "flowId": "F01", "operationalPriority": null, "priorityFactStatus": "NEEDS_CONFIRMATION", "factStatus": "CONFIRMED"},
    {"id": "2-2", "name": "退職時のアカウント停止・データ保管", "flowId": "F01", "operationalPriority": null, "priorityFactStatus": "NEEDS_CONFIRMATION", "factStatus": "CONFIRMED"},
    {"id": "2-3", "name": "部署異動に伴う権限変更", "flowId": "F01", "operationalPriority": null, "priorityFactStatus": "NEEDS_CONFIRMATION", "factStatus": "CONFIRMED"},
    {"id": "2-4", "name": "SentinelOne検知後の対応", "flowId": "F06", "operationalPriority": null, "priorityFactStatus": "NEEDS_CONFIRMATION", "factStatus": "CONFIRMED"},
    {"id": "2-5", "name": "セキュリティ監視・月次レポート", "flowId": "F06", "operationalPriority": null, "priorityFactStatus": "NEEDS_CONFIRMATION", "factStatus": "CONFIRMED"},
    {"id": "2-6", "name": "ソフトウェア更新（パッチ）管理", "flowId": "F02", "operationalPriority": null, "priorityFactStatus": "NEEDS_CONFIRMATION", "factStatus": "CONFIRMED"},
    {"id": "2-7", "name": "セキュリティインシデント対応", "flowId": "F06", "operationalPriority": null, "priorityFactStatus": "NEEDS_CONFIRMATION", "factStatus": "CONFIRMED"},
    {"id": "2-8", "name": "セキュリティ教育・啓発", "flowId": "F10", "operationalPriority": null, "priorityFactStatus": "NEEDS_CONFIRMATION", "factStatus": "CONFIRMED"},
    {"id": "3-1", "name": "管理コンソールの設定変更（方針レベル）", "flowId": "F04", "operationalPriority": null, "priorityFactStatus": "NEEDS_CONFIRMATION", "factStatus": "CONFIRMED"},
    {"id": "3-2", "name": "エラー・問い合わせの臨時対応", "flowId": "F04", "operationalPriority": null, "priorityFactStatus": "NEEDS_CONFIRMATION", "factStatus": "CONFIRMED"},
    {"id": "3-3", "name": "SF管理（ユーザー・設定・開発連携）", "flowId": "F04", "operationalPriority": null, "priorityFactStatus": "NEEDS_CONFIRMATION", "factStatus": "CONFIRMED"},
    {"id": "3-4", "name": "社内ポータル・マニュアルの管理", "flowId": "F07", "operationalPriority": null, "priorityFactStatus": "NEEDS_CONFIRMATION", "factStatus": "CONFIRMED"},
    {"id": "3-5", "name": "SaaS契約の更新管理", "flowId": "F08", "operationalPriority": null, "priorityFactStatus": "NEEDS_CONFIRMATION", "factStatus": "CONFIRMED"},
    {"id": "3-6", "name": "未使用ライセンスの洗い出し", "flowId": "F08", "operationalPriority": null, "priorityFactStatus": "NEEDS_CONFIRMATION", "factStatus": "CONFIRMED"},
    {"id": "4-1", "name": "定型依頼への対応", "flowId": "F07", "operationalPriority": null, "priorityFactStatus": "NEEDS_CONFIRMATION", "factStatus": "CONFIRMED"},
    {"id": "4-2", "name": "非定型・判断を要する依頼", "flowId": "F07", "operationalPriority": null, "priorityFactStatus": "NEEDS_CONFIRMATION", "factStatus": "CONFIRMED"},
    {"id": "4-3", "name": "緊急対応（紛失・ウイルス・誤送信等）", "flowId": "F06", "operationalPriority": null, "priorityFactStatus": "NEEDS_CONFIRMATION", "factStatus": "CONFIRMED"},
    {"id": "4-4", "name": "高度な技術トラブルの調査・解決", "flowId": "F07", "operationalPriority": null, "priorityFactStatus": "NEEDS_CONFIRMATION", "factStatus": "CONFIRMED"},
    {"id": "4-5", "name": "既知トラブルの対応", "flowId": "F07", "operationalPriority": null, "priorityFactStatus": "NEEDS_CONFIRMATION", "factStatus": "CONFIRMED"},
    {"id": "4-6", "name": "パスワードリセット・ログイン支援", "flowId": "F07", "operationalPriority": null, "priorityFactStatus": "NEEDS_CONFIRMATION", "factStatus": "CONFIRMED"},
    {"id": "5-1", "name": "データバックアップの方針", "flowId": "F09", "operationalPriority": null, "priorityFactStatus": "NEEDS_CONFIRMATION", "factStatus": "CONFIRMED"},
    {"id": "5-2", "name": "ログの定期エクスポート", "flowId": "F09", "operationalPriority": null, "priorityFactStatus": "NEEDS_CONFIRMATION", "factStatus": "CONFIRMED"},
    {"id": "5-3", "name": "ログの取得状況の把握", "flowId": "F09", "operationalPriority": null, "priorityFactStatus": "NEEDS_CONFIRMATION", "factStatus": "CONFIRMED"},
    {"id": "5-4", "name": "データ削除・復活・操作確認の依頼対応", "flowId": "F05", "operationalPriority": null, "priorityFactStatus": "NEEDS_CONFIRMATION", "factStatus": "CONFIRMED"},
    {"id": "6-1", "name": "サポート問い合わせ・技術連携", "flowId": "F08", "operationalPriority": null, "priorityFactStatus": "NEEDS_CONFIRMATION", "factStatus": "CONFIRMED"},
    {"id": "6-2", "name": "契約交渉・プラン変更", "flowId": "F08", "operationalPriority": null, "priorityFactStatus": "NEEDS_CONFIRMATION", "factStatus": "CONFIRMED"},
    {"id": "6-3", "name": "IT予算計画の作成", "flowId": "F08", "operationalPriority": null, "priorityFactStatus": "NEEDS_CONFIRMATION", "factStatus": "CONFIRMED"},
    {"id": "6-4", "name": "経営向けIT報告", "flowId": "F10", "operationalPriority": null, "priorityFactStatus": "NEEDS_CONFIRMATION", "factStatus": "CONFIRMED"},
    {"id": "6-5", "name": "PwC指摘対応・規程整備", "flowId": "F10", "operationalPriority": null, "priorityFactStatus": "NEEDS_CONFIRMATION", "factStatus": "CONFIRMED"},
    {"id": "7-1", "name": "年間スケジュール18項目の運用", "flowId": "F10", "operationalPriority": null, "priorityFactStatus": "NEEDS_CONFIRMATION", "factStatus": "CONFIRMED"},
    {"id": "7-2", "name": "2ヶ月毎の社内点検", "flowId": "F10", "operationalPriority": null, "priorityFactStatus": "NEEDS_CONFIRMATION", "factStatus": "CONFIRMED"},
    {"id": "7-3", "name": "2026年9月〜2027年3月の更新審査対応", "flowId": "F10", "operationalPriority": null, "priorityFactStatus": "NEEDS_CONFIRMATION", "factStatus": "CONFIRMED"},
    {"id": "7-4", "name": "Pマーク文書の管理・見直し", "flowId": "F10", "operationalPriority": null, "priorityFactStatus": "NEEDS_CONFIRMATION", "factStatus": "CONFIRMED"}
  ],
  "eventTemplates": [
    {"id": "EV-01", "name": "入社", "operationIds": ["2-1", "1-5", "2-8", "4-1"], "initialRisk": "R1", "riskNote": "標準的な入社準備", "nameFactStatus": "CONFIRMED", "mappingFactStatus": "PROPOSED"},
    {"id": "EV-02", "name": "退職", "operationIds": ["2-2", "1-6", "1-3", "5-2"], "initialRisk": "R2", "riskNote": "停止・移行・削除前承認", "nameFactStatus": "CONFIRMED", "mappingFactStatus": "PROPOSED"},
    {"id": "EV-03", "name": "異動・組織変更", "operationIds": ["2-3", "1-3", "3-1", "3-3"], "initialRisk": "R1", "riskNote": "権限差分を確認", "nameFactStatus": "CONFIRMED", "mappingFactStatus": "PROPOSED"},
    {"id": "EV-04", "name": "Wi-Fi・全社ネットワーク障害", "operationIds": ["1-1", "1-2", "4-4"], "initialRisk": "R1", "riskNote": "全社影響または不正兆候でR3", "nameFactStatus": "CONFIRMED", "mappingFactStatus": "PROPOSED"},
    {"id": "EV-05", "name": "PC故障・紛失・利用不能", "operationIds": ["1-8", "1-7", "4-3"], "initialRisk": "R1", "riskNote": "紛失はR3", "nameFactStatus": "CONFIRMED", "mappingFactStatus": "PROPOSED"},
    {"id": "EV-06", "name": "ウイルス・誤送信・不正アクセス疑い", "operationIds": ["4-3", "2-4", "2-7", "5-2"], "initialRisk": "R3", "riskNote": "固定プレイブックと即時共有", "nameFactStatus": "CONFIRMED", "mappingFactStatus": "PROPOSED"},
    {"id": "EV-07", "name": "SaaSログイン不可・業務システム障害", "operationIds": ["3-2", "4-6", "4-4", "6-1"], "initialRisk": "R1", "riskNote": "全社影響または不正兆候でR3", "nameFactStatus": "CONFIRMED", "mappingFactStatus": "PROPOSED"},
    {"id": "EV-08", "name": "Drive権限・外部共有", "operationIds": ["1-3", "1-4", "5-4"], "initialRisk": "R2", "riskNote": "外部共有は承認必須", "nameFactStatus": "CONFIRMED", "mappingFactStatus": "PROPOSED"},